मधुरभाषणं कटुस्थितिलोपकम्	இனிமையான பேச்சு கசப்பான சூழ்நிலையை அழிக்கிறது.
उग्रतायामपि स्वीयो, नैव त्याज्यो हि संयमः। मधुरं भाषणं चापि, कटुस्थितिं विलोपयेत्॥	கடுமையிலும் கூட, தன் சுயக்கட்டுப்பாட்டைக் கைவிடக் கூடாது. இனிமையான பேச்சு, உண்மையில், கசப்பான சூழ்நிலையை அகற்றும்.
महाशय! भवदीयः आत्मजः क्रिकेटं क्रीडन् मम वातायनस्य बहुमूल्यं काचं त्रोटितवान् अस्ति। अस्य क्षतिपूर्तिः भवता करणीया	ஐயா! உங்கள் மகன், கிரிக்கெட் விளையாடிக் கொண்டிருக்கும் போது,   என் ஜன்னல் கண்ணாடியை உடைத்து விட்டான். இந்த சேதத்திற்கு நீங்கள் ஈடு கொடுக்க வேண்டும்.
प्रतिवेशी श्यामसुन्दरं कथितवान्।	பக்கத்து வீட்டுக்காரர் சியாமசுந்தராவிடம் சொன்னார்.
बालकः एव तु अस्ति सः। भवता अपि बाल्ये बहूनां हानिः कृता स्यात्। इह ध्यानं न देयं बहु। किं प्रतिवेशितः क्षतिमूल्यं याच्यते?	ஆனால் அவன் சிறுவன் மட்டுமே. உங்கள் குழந்தைப் பருவத்தில் நீங்கள் மிகவும் தீங்கு செய்திருக்கலாம். இங்கு அதிக கவனம் செலுத்த வேண்டியதில்லை. அண்டை வீட்டாரிடம் ஏன் இழப்பீடு கேட்கப்படுகிறது?
श्यामसुन्दरः प्रतिवेशिनं पृष्टवान्।	ஷியாமசுந்தரா பக்கத்து வீட்டுக்காரரிடம் கேட்டார்.
यदि सः बालकः एव अस्ति, तर्हि आत्मनः एव वातायनस्य काचं किं न त्रोटितवान्?	அவன் சிறுவனாக இருந்தால் ஏன் அவனே ஜன்னல் கண்ணாடியை உடைக்கவில்லை?
प्रतिवेशी जिज्ञासां कुतवान्।	பக்கத்து வீட்டுக்காரர் ஆர்வத்தில் கேட்டார்.
सः न अस्ति इयान् मूर्खः	அவர் அப்படிப்பட்ட முட்டாள் இல்லை.
श्यामसुन्दरः उत्तरं दत्तवान् इति।	அதற்கு ஷியாமசுந்தரர் பதில் அளித்தார், இவ்வாறு கூறப்பட்டுள்ளது.
प्रतिवेशी श्यामसुन्दरं किं कथितवान्?	பக்கத்து வீட்டுக்காரர் ஷியாமசுந்தரரிடம் என்ன சொன்னார்?
श्यामसुन्दरः प्रतिवेशिनं किम् उदतरत्?	பக்கத்து வீட்டுக்காரரிடம் சியாமசுந்தரா என்ன சொன்னார்?
प्रतिवेशी तदा श्यामसुन्दरं किम् अपृच्छत्?	அப்போது பக்கத்து வீட்டுக்காரர் சியாமசுந்தரரிடம் என்ன கேட்டார்?
श्यामसुन्दरस्य प्रतिवेशिने तदा किम् उत्तरम् आसीत्?	அப்போது சியாமசுந்தராவுக்கு பக்கத்து வீட்டுக்காரர் என்ன பதில் சொன்னார்?
कटुस्थितिं किं विलोपयति?	வலிமிகுந்த சூழ்நிலையை எது அழிக்கிறது?
कारुण्यमैत्र्योः प्रभावः	கருணை மற்றும் அன்பின் ஆற்றல்.
कारुण्यं मित्रता यस्य, चित्ते नित्यं विराजते । ईश्वरोऽपि ततस्तुष्टः, तदिच्छापूरको भवेत् ॥	எவனுடைய கருணையும் நட்பும் அவனது மனதில் (சிட்டா) தொடர்ந்து பிரகாசிக்கிறதோ, அவனுடைய இறைவன் (ஈஸ்வரன்) கூட அவனால் மகிழ்ச்சியடைந்து, அவனது விருப்பங்களை நிறைவேற்றுகிறான்.
एकः धार्मिकः सत्सङ्गानुरागी राजा आसीत्।	நல்லவர்களின் சகவாசத்தை விரும்பும் நீதியுள்ள அரசன் ஒருவன் இருந்தான்.
सः दूरदूरात् साधून् महात्मनः आहूय तेभ्यः ज्ञानोपदेशं शृणोति स्म, तान् धनादिप्रदानेन सम्मानयति स्म।	அவர், தொலைதூரத்தில் இருந்து நல்லொழுக்கமுள்ள பெரிய ஆன்மாக்களை வரவழைத்து, ஞானத்தில் அவர்களின் அறிவுரைகளைக் கேட்டு, செல்வம் மற்றும் பலவற்றைக் கொண்டு அவர்களைக் கௌரவித்தார்.
एकदा एकः महात्मा ततः दानदक्षिणाम् आदाय परावर्तमानः कैश्चित् दस्युभिः दृष्टः।	ஒருமுறை, ஒரு பெரியவர், அங்கிருந்து காணிக்கைகளையும் காணிக்கைகளையும் எடுத்துக்கொண்டு, அவர் திரும்பிக்கொண்டிருந்தபோது சில கொள்ளையர்களால் கண்டார்.
ते दस्यवः तस्य साधोः हस्तौ कर्तयित्वा दानदक्षिणाम् आच्छिद्य च पलायितवन्तः।	அந்த கொள்ளையர்கள் அந்த புனித மனிதரின் கைகளை வெட்டி, அவருடைய காணிக்கைகளையும் காணிக்கைகளையும் பறித்துக்கொண்டு ஓடிவிட்டனர்.
कतिपयमासानन्तरं सः एव महात्मा राज्ञा पुनरपि भगवच्चर्चायै आहूतः।	சில மாதங்களுக்குப் பிறகு, அந்தப் பெருமான் மீண்டும் பகவானைப் பற்றிய விவாதத்திற்கு அரசனால் அழைக்கப்பட்டார்.
अस्मिन् वारे दस्यवः अपि साधुवेषं धृत्वा तस्मिन् राजकीये सत्सङ्गे समुपस्थिताः।	இந்த நிகழ்வில், கொள்ளையர்கள் கூட, நல்ல மனிதர்களின் வேடத்தில், அந்த அரச சபையில் இருந்தனர்.
"तान् दृष्ट्वा कृत्तहस्तः महात्मा राजानं कथितवान् - ""महाराज! इमे साधवः मम ज्ञानिनः सुहृदः सन्ति। इमे अवश्यं सम्माननीयाः।"""	"அவர்களைப் பார்த்ததும், கைகள் வெட்டப்பட்ட பெரிய மனிதர் (மகாத்மா), அரசனிடம் கூறினார்: ""ஓ பெரிய ராஜா (மஹாராஜா)! இந்த துறவிகள் எனது ஞான நண்பர்கள். அவர்கள் நிச்சயமாக மதிக்கப்பட வேண்டும்."""
राजा तान् अपूजयत्, एकां बृहतीं धनपेटिकां च तेषाम् आवासे प्रापयितुं स्वकीयम् एकं कर्मचारिणं प्रेष्तवान्।	அரசன் அவர்களைக் கௌரவித்து, ஒரு பெரிய பொக்கிஷப் பெட்டியை அவர்கள் வசிப்பிடத்திற்குக் கொண்டு வருமாறு தன் வேலையாட்களில் ஒருவனை அனுப்பினான்.
"मार्गे कर्मचारी तान् साधून् अपृच्छत् - ""कथ्यताम् महात्मा भवतः कथं जानाति? कथम् असौ भवद्भ्यः इदं धनम् अदापयत्?"""	"சாலையில், அதிகாரி சந்நியாசிகளிடம் கேட்டார்: ""சொல்லுங்கள், பெரிய ஆத்மா உங்களை எப்படி அறிவார்? இந்த செல்வத்தை அவர் எப்படி உங்களுக்கு வழங்கினார்?"""
"साधवः उदतरन् - ""सः मृत्युमुखे आसीत्। वयम् एव तं मृत्योः अमोचयाम। हस्तौ एव तस्य कर्तितौ अभवताम्। अतः एव उपकारकान् अस्मान् सः महाराजेन सममानयत्।"""	"நல்லவர்கள் பதிலளித்தனர்: ""அவர் மரணத்தின் தாடையில் இருந்தார் (ம்ருத்யுமுகே ஆசித்). நாமே அவரை மரணத்திலிருந்து மீட்டோம் (ம்ருத்யோ அமோசயமா) அவரது கைகள் (ஹஸ்தௌ) துண்டிக்கப்பட்டன. எனவே, அவர் பெரிய மன்னருக்கு நிகரான எங்களைக் கௌரவித்தார்."""
