किन्तु दैवयोगात् तदा अर्जुनस्य बाणेन विच्छिन्ना बृहती गुर्वी गजघण्टा निपत्य तान् अण्डाम् आच्छादयत्।	ஆனால் விதியின் தாக்கத்தால், ஒரு பெரிய, கனமான யானை மணி, அர்ஜுனனின் அம்பினால் துண்டிக்கப்பட்டு, அந்த முட்டைகளை மூடிக்கொண்டது.
यथासमयं तत्र अण्डेभ्यः चत्वारः शावकाः निःसृताः।	சரியான நேரத்தில், நான்கு இளம் பறவைகள் அங்குள்ள முட்டைகளிலிருந்து வெளிப்பட்டன.
अनाथाः ते कञ्चित् कालम् एवम् एव विना आहारं स्थिताः।	சில காலம் இப்படியே உணவின்றி ஆதரவற்று தவித்தனர்.
युद्धे समाप्ते तेन मार्गेण शिष्यैः सह गच्छता शमीकेन ऋषिणा तेषां शावकानां करुणक्रन्दनम् आकर्ण्य 'कुतः एतद्? ज्ञायताम् इदम्'	"போர் முடிந்ததும், ஷாமிக முனிவர், தம் சீடர்களுடன் அந்தப் பாதையில் செல்லும்போது,   அந்த இளம் விலங்குகளின் பரிதாபமான அழுகுரல்களைக் கேட்டு, ""இது எங்கிருந்து வருகிறது? அதைத் தெரியப்படுத்துங்கள்!"""
इति गुरुणा आदिष्टाः शिष्याः क्रन्दनम् अनुसरन्तः घण्टायाः अधः शावकान् दृष्ट्वा गुरुदेवम् अदर्शयन्।	இவ்வாறு தங்கள் ஆசிரியரின் அறிவுறுத்தலின் பேரில், மாணவர்கள், அழுகை சத்தத்தைத் தொடர்ந்து, குட்டிகளை மணியின் அடியில் பார்த்து, தங்கள் மதிப்பிற்குரிய ஆசிரியரிடம் காண்பித்தனர்.
कारुणिकः शमीकः 'सत्त्ववन्तः आयुष्मन्तः च इमे'	"இரக்கமுள்ள ஷாமிகா [சிந்தனை], ""இந்த உயிரினங்கள் *சத்வா* மற்றும் நீண்ட ஆயுள் கொண்டவை (āyuṣmantaḥ)."""
इति उक्त्वा तान् स्वाश्रमे आनीय यथोचिताहारपानप्रदानादिना अपोषयत्।	இப்படிச் சொல்லி, அவர்களைத் தன் துறவறத்திற்கு அழைத்து வந்து, அவர்களுக்குத் தகுந்த உணவு, பானங்கள் மற்றும் பிற பொருட்களைக் கொடுத்து ஊட்டினார்.
यथासमयं जातपक्षाः ते अकस्मात् एकस्मिन् दिने उदडीयन्त।	நேரம் சரியாகி, அவற்றின் சிறகுகள் வளர்ந்தபோது,   திடீரென்று ஒரு நாள் பறந்து சென்றன.
ते एव केषुचित् मासेषु परावृत्य आत्मानं परिचाययन्तः शमीकम् ऋषिं प्रणम्य मनुष्यवाचा तं प्रति स्वीयां कृतज्ञतां भूरिभूरि निवेदितवन्तः।	சில மாதங்களுக்குப் பிறகு, திரும்பி வந்து தங்களை அறிமுகப்படுத்திக் கொண்டு, அவர்கள் ஷாமிகா முனிவரை வணங்கி, மனிதப் பேச்சில், மீண்டும் மீண்டும் அவருக்கு நன்றியைத் தெரிவித்தனர்.
सर्वेषु साश्चर्यं पश्यत्सु स्वपरिचयः तैः एवं दत्तः यत् वयं पूर्वजन्मनि योगिराजस्य सुकृषस्य मुनेः आत्मजाः आस्म।	"அனைவரும் ஆச்சரியத்துடன் பார்த்துக் கொண்டிருந்தபோது,   அவர்கள் தங்களை இவ்வாறு அறிமுகப்படுத்திக் கொண்டனர்: ""எங்கள் முந்தைய வாழ்க்கையில், நாங்கள் யோகிகளின் அரசரான சுக்ருஷ முனிவரின் மகன்கள்."""
पित्रा अभिशप्ताः इमाम् अधमां गृध्रयोनिं प्राप्तवन्तः।	தந்தையால் சபிக்கப்பட்ட அவர்கள், கழுகுகளாக இருக்கும் இந்த மோசமான நிலையை அடைந்தனர்.
अभिशापहेतुः अयम् एव यत् एकदा कश्चित् त्रुटितपक्षः मुमूर्षुः गृध्रः अस्माकं पितुः उत्सङ्गे निपतितः।	சாபத்திற்குக் காரணம் இதுதான்: ஒருமுறை ஒரு கழுகு, சிறகுகள் உடைந்து இறக்கத் தயாராக இருந்தது, எங்கள் தந்தையின் மடியில் விழுந்தது.
कतिचनदिनेभ्यः क्षुधितं तं स्वीयं यथेच्छम् आहारं निर्देष्टुं सः कथितवान्।	சில நாட்களுக்குப் பிறகு, அவர் பசித்தவரிடம் அவர் விரும்பிய உணவைக் குறிப்பிடச் சொன்னார்.
गृध्रः तु मनुष्यस्य सद्यस्कं मांसं भक्षितुम् इच्छाम् अभिव्यक्तवान्।	கழுகு மனிதனின் புதிய சதையை உண்ண தனது விருப்பத்தை வெளிப்படுத்தியது.
तदा पिता अस्मान् तस्य इच्छां स्वशरीरदानेन पूरयितुम् आदिशत्।	அப்போது,   எங்கள் உடல்களை தானம் செய்து அவரது ஆசையை நிறைவேற்றும்படி என் தந்தை உத்தரவிட்டார்.
परन्तु वयं तस्य आदेशं न्यक्कृतवन्तः।	ஆனால் நாங்கள் அவருடைய கட்டளையை நிராகரித்தோம்.
अनेन अभिरुष्टः पिता अस्मान् अभिशप्तवान् यत् यूयम् अपि गृध्राः एव भवत।	"இதனால் கோபமடைந்த தந்தை, ""நீங்களும் கழுகுகள் ஆகட்டும்"" என்று எங்களை சபித்தார்."
ततः आत्मानम् एव सः गृध्राय दातुं यदा प्रवृत्तः, तदा 'अहं जीवितव्यक्तेः मांसं न भक्षामि'	"பின்னர், அவர் கழுகுக்கு தன்னைக் கொடுக்க முற்பட்டபோது,   [கழுகு,] ""நான் உயிரினங்களின் இறைச்சியை உண்பதில்லை."""
इति गृध्रः अकथयत्।	இவ்வாறு, கழுகு பேசினார்.
इदम् आकर्ण्य 'अहं प्राणान् आयम्य म्रिये, त्वं तदा मां भक्षय'	"இதைக் கேட்டவுடன், ""நான் என் உயிர் மூச்சை அடக்கிக்கொண்டு இறந்துவிடுவேன்; பிறகு நீங்கள் என்னை உண்ணலாம்."""
इति उक्तवान्।	இவ்வாறு அவர் கூறினார்.
तदा सः गृध्रः देवेन्द्ररूपे आविर्भूय तस्य त्यागं बहु बहु प्रशंसितवान् तथा अस्मभ्यं दत्तं शापं परावर्तयितुम् अपि तं साग्रहं न्यवेदयत्।	அப்போது அந்த கழுகு, தேவர்களின் அதிபதியான (தேவேந்திரன்) சக்ர வடிவில் தோன்றி, அவனது பெருந்தன்மையை வெகுவாகப் பாராட்டி, நமக்குக் கொடுக்கப்பட்ட சாபத்தையும் திரும்பப் பெறும்படி வேண்டினான்.
शापः तु सर्वथा अपरावर्तनीयः, किन्तु एषां ज्ञानं मनुष्यवाणी च यथावत् स्थास्यति, शापमोक्षः अपि तपोनुष्ठानेन एव भविता'	எவ்வாறாயினும், சாபம் முற்றிலும் மாற்ற முடியாதது, ஆனால் அவர்களின் அறிவும் மனித பேச்சும் முன்பு போலவே இருக்கும், மேலும் சாபத்திலிருந்து விடுபடுவது சந்நியாசத்தின் (தபஸ்) செயல்பாட்டின் மூலம் மட்டுமே வரும்.
इति देवेन्द्रं स उदतरत्।	இவ்வாறு அவர் தேவேந்திரனுக்கு பதிலளித்தார்.
तद् इदानिं तपोद्वारा श्रीहरिम् एव प्रासादयितुं हिमगिरिशिखरं वयं प्रयामः, इति उक्त्वा शमीकम् ऋषिं प्रणम्य ते यथा आगताः तथा एव हरिनाम उच्चारयन्तः युदपद् एव उड्डीनाः इति।	எனவே, இப்போது,   துறவறத்தின் மூலம், ஸ்ரீ ஹரியையே சாந்தப்படுத்த இமயமலையின் உச்சிக்குச் செல்வோம். இதைச் சொல்லிவிட்டு, ஷாமிக முனிவரை வணங்கிவிட்டு, அவர்கள் வந்தவாறே, ஹரியின் நாமத்தை உச்சரித்து, ஆகாயத்தில் பறந்தார்கள்.
शमीकः ऋषिः शिष्यान् किम् आदिशत् ?	ஷாமிகா முனிவர் தன் சீடர்களுக்கு என்ன கட்டளையிட்டார்?
शिष्याः किम् अकुर्वन् ?	மாணவர்கள் என்ன செய்தார்கள்?
जातपक्षाः गृध्रीशावकाः आत्मानं शमीकं कथं पर्यचाययन् ?	சிறகுகள் துளிர்விட்ட இளம் கழுகுகள், சமிகாவிடம் தங்களை எப்படி அறிமுகப்படுத்தின?
शमीकं प्रणम्य शावकाः कुत्र गन्तुम् उड्डीनाः ?	சமிகாவை வணங்கிவிட்டு, குஞ்சுகள் எங்கு செல்ல பறந்தன?
अनया कथया का शिक्षा मिलति ?	இந்தக் கதையிலிருந்து என்ன பாடம் கற்றுக்கொள்கிறது?
प्रतिष्ठादायकाः गुणाः	கௌரவத்தை அளிக்கும் குணங்கள்.
न जात्या पूज्यते व्यक्तिः, न धर्मेण च मान्यते। अद्वितीया गुणास्तस्याः, तां प्रतिष्ठापयन्ति हि॥	ஒருவன் பிறப்பினால் மதிக்கப்படுவதில்லை, தர்மத்தால் மதிக்கப்படுவதில்லை. அவளுடைய தனித்துவமான குணங்கள், உண்மையில், அவளை நிறுவுகின்றன.
गुरुशुश्रूषया स्वकीयेन परिश्रमेण च माया एका हरिजनबाला भूत्वा अपि महिलाचिकित्सालयस्य अधीक्षिका सञ्जाता।	தனது குருவின் சேவையினாலும், தன் சொந்த முயற்சியினாலும், மாயா, வெறும் ஹரிஜனப் பெண்ணாக இருந்தாலும், பெண்கள் மருத்துவமனையின் கண்காணிப்பாளராக ஆனார்.
ताम् एकः उच्चवर्गीयः प्राध्यापकः उद्वोढुम् इच्छति स्म।	ஒரு உயர் வகுப்பு பேராசிரியர் அவளை திருமணம் செய்து கொள்ள விரும்பினார்.
परन्तु इह तस्य परिवारस्य अनुमतिः सहमतिः न आसीत्।	ஆனால், இங்கு அவரது குடும்பத்தினரின் அனுமதியோ, உடன்படிக்கையோ இல்லை.
किन्तु यदा तस्य जननी एव तस्याः चिकित्सया मृत्योः मुखतः आत्मानं मुक्तां दृष्टवती, तदा तद्‌गुणाकृष्टहृदया सा तां वधूरूपे स्वीकर्तुं सम्पूर्णम् अपि परिवारम् अनुकूलं कृतवती।	ஆனால் அவள் (பெண்) சிகிச்சையால் மரணத்தின் தாடையில் இருந்து தன்னைக் காப்பாற்றியதைக் கண்ட அவனது தாய், பின்னர், அவளுடைய நற்பண்புகளில் ஈர்க்கப்பட்ட இதயத்துடன், அவளை மருமகளாக ஏற்றுக்கொள்ள முழு குடும்பத்தையும் வென்றாள்.
अद्य तयोः दाम्पत्ये न कश्चित् अपि सामाजिकः अङ्गुलिम् उत्थापयति इति।	இன்று இவர்களது திருமணத்தில் யாரும் விரல் உயர்த்துவதில்லை.
माया का आसीत्? तां कः उद्वोढुम् इच्छति स्म?	மாயை (மாயா) என்றால் என்ன? யார் அவளை திருமணம் செய்து கொள்ள விரும்பினார்கள்?
तत्र अनुमतिः सहमतिः वा कस्य न आसीत्?	எனவே, யாருடைய ஒப்புதல் அல்லது உடன்பாடு இல்லை?
मायां वधूरूपे स्वीकर्तुं का अनुकूलं कृतवती?	*மாயாவை மணமகளாக ஏற்க முடிவு செய்தவர் யார்?
व्यक्तिः केन न पूज्यते न मान्यते च?	தனிமனிதன் யாரால் வணங்கப்படுவதில்லை, மதிக்கப்படுவதில்லை?
व्यक्तिं प्रतिष्ठां के प्रापयन्ति?	உயிர்கள் உணர்ந்து நிலைபெறச் செய்வது யார்?
कार्यं सिध्यति युक्त्यैव	பகுத்தறிவு மூலம் பணி நிறைவேற்றப்படுகிறது.
शारीरं स्वबलं यत्र, कार्यं साधयते नहि। तत्र युक्तिबलेनैव, कार्यं सिध्यति तत्क्षणम्॥	உடல் வலிமை இல்லாத நிலையில், பணியை நிறைவேற்ற முடியாத இடத்தில், திறமையான வழிமுறைகளால் மட்டுமே, பணி உடனடியாக நிறைவேற்றப்படுகிறது.
अयि किं शयिष्यते एव? चौरः भित्तिं त्रोटयति	அட, நீ அப்படியே தூங்குவாயா? ஒரு திருடன் சுவரை உடைக்கிறான்!
पतिं जागरयन्ती पत्नी कथितवती।	மனைவி, கணவனை எழுப்பி, சொன்னாள்.
"जागरितः पतिः उच्चैः उच्चैः अवदत् येन चौरः अपि तत् शृणुयात् - ""अरे! अत्र चिन्तायाः का वार्ता? अहं किं मूर्खः अस्मि यत् आत्मनः धनं तव च सुवर्णाभूषणानि गृहे रक्षेयम्? इदं सर्वं तु एकस्यां पोटलिकायां बद्ध्वा बहिर्वृक्षोपरि एकस्यां शाखायाम् अवलम्बितवान् अस्मि। ततः चौरः तु किं? तस्य पिता अपि नेतुं न शक्नोति।"""	"கண்விழித்த கணவன் சத்தமாகப் பேசினான், திருடனுக்கும் கேட்கும்படியாக: ""ஏய்! இங்கே என்ன கவலை? என் செல்வத்தையும், உன் தங்க நகைகளையும் வீட்டில் வைப்பதற்கு நான் முட்டாளா? இதையெல்லாம் ஒரு மூட்டையாகக் கட்டி வெளியே மரக்கிளையில் தொங்கவிட்டேன். அதனால், திருடனால் என்ன? அவனுடைய தந்தையால் அதை எடுக்க முடியாது."""
चौरः इदं श्रुत्वा तत्र एव प्राप्तः।	இதைக் கேட்டதும் திருடன் அங்கு வந்தான்.
आसीत् इयं कृष्णपक्षस्य रात्रिः।	இருண்ட பதினைந்து நாட்களின் இரவு இது.
घोरान्धकारे चौरः सम्यक् द्रष्टुं न अशक्नोत्।	அடர்ந்த இருளில் திருடனால் தெளிவாகப் பார்க்க முடியவில்லை.
सः शीघ्रं शीघ्रं वृक्षम् आरूढः।	வேகமாக மரத்தில் ஏறினான்.
तत्र पूर्वतः विद्यमानं मधुमक्षिकाच्छत्रम् एव आभूषणपोटलीं मन्वानः सः यथा अस्पृशत्, तथा एव मधुमक्षिकाः उद्बुद्धाः, तं च सर्वथा अदंशन्।	அங்கு, தனக்கு எதிரே இருந்த தேன்கூடு ஆபரண மூட்டை என்று நினைத்து, அதைத் தொட்டவுடனே, தேனீக்கள் எழுந்து அவரைக் குத்தியது.
अनेन भूमौ पतितः चौरः यथाकथञ्चित् उत्थाय पलायितः इति।	தரையில் விழுந்த திருடன் எப்படியோ எழுந்து ஓடிவிட்டான்.
पतिः पत्नीं किम् अवदत् ?	கணவன் மனைவியிடம் என்ன சொன்னான்?
चौरः तदा किम् अकरोत् ?	அப்போது திருடன் என்ன செய்தான்?
मधुमक्षिकाः चौरं किम् अदंशन् ?	தேனீக்கள் ஏன் திருடனைக் கடிக்கவில்லை?
चौरः कथं पलायितः ?	திருடன் எப்படி தப்பினான்?
युक्तिबलं कार्यं कदा साधयति ?	பகுத்தறிவின் சக்தி எப்போது விளைவை நிறைவேற்றுகிறது?
मानवः कः?	ஒரு மனிதன் (மானவன்) யார்?
विना मानवतां शिक्षा, व्यर्था किं नहि वर्तते? । असहायस्य साहाय्यं, यः करोति स मानवः ॥	மனிதாபிமானம் இல்லாமல், கல்வி அர்த்தமற்றதாகிவிடாதா? ஆதரவற்றவர்களுக்கு உதவி செய்பவன் உண்மையான மனிதன்.
मम मित्रस्य एकः विदेशी सहपाठी आसीत्।	எனது நண்பருக்கு வெளிநாட்டு வகுப்புத் தோழி ஒருவர் இருந்தார்.
एकदा सः भारतभ्रमणाय आयातः।	ஒருமுறை, இந்தியாவுக்குச் சுற்றுப்பயணம் செய்ய வந்தார்.
मम मित्रं तं सुरम्ये पर्वतीयस्थले भ्रामयितुम् अनयत्।	என் நண்பன் அவனை ஒரு அழகான மலைப்பாங்கான இடத்தில் அலைய அழைத்துச் சென்றான்.
प्राकृतिकदृश्येषु सः अत्यन्तं मुग्धः आसीत्।	அவர் இயற்கை காட்சிகளால் மிகவும் ஈர்க்கப்பட்டார்.
तत्र एकः वृद्धः वनचरः मिलितः।	அங்கு, ஒரு வயதான காட்டுவாசி [அவரை] சந்தித்தார்.
